[
  {
    "promise_id": "PP_01",
    "description": "Why did one of Jacen's last shipments have two lives? — the central mystery.",
    "promise_type": "plot",
    "setup_scene": "ch01_sc01",
    "payoff_scene": "ch16_sc99",
    "due_by_scene": "ch16_sc99",
    "status": "planted",
    "progression_log": [],
    "created_at": "2026-05-18T03:34:16+00:00",
    "updated_at": "2026-05-18T03:34:16+00:00"
  },
  {
    "promise_id": "PP_02",
    "description": "The forced Ben/Talon partnership will outlast the case as a real partnership — not a transaction.",
    "promise_type": "character",
    "setup_scene": "ch09_sc01",
    "payoff_scene": "ch34_sc99",
    "due_by_scene": "ch34_sc99",
    "status": "planted",
    "progression_log": [],
    "created_at": "2026-05-18T03:34:16+00:00",
    "updated_at": "2026-05-18T03:34:16+00:00"
  },
  {
    "promise_id": "PP_03",
    "description": "Restraint can cost lives — Ben will learn this not as a philosophical position but as a body lying still after he held the line.",
    "promise_type": "thematic",
    "setup_scene": "ch15_sc01",
    "payoff_scene": "ch16_sc99",
    "due_by_scene": "ch16_sc99",
    "status": "planted",
    "progression_log": [],
    "created_at": "2026-05-18T03:34:16+00:00",
    "updated_at": "2026-05-18T03:34:16+00:00"
  },
  {
    "promise_id": "PP_04",
    "description": "Every door except Iresh will be closed — the institutional path, the documentary path, the legal path, the time path. Ben will go off-grid because there is no other door.",
    "promise_type": "plot",
    "setup_scene": "ch20_sc01",
    "payoff_scene": "ch32_sc99",
    "due_by_scene": "ch32_sc99",
    "status": "planted",
    "progression_log": [],
    "created_at": "2026-05-18T03:34:16+00:00",
    "updated_at": "2026-05-18T03:34:16+00:00"
  },
  {
    "promise_id": "PP_05",
    "description": "Ben will use Jacen's lessons — the crisis logic the GAG year built into him will save lives that the ordinary Jedi path cannot save.",
    "promise_type": "character",
    "setup_scene": "ch02_sc01",
    "payoff_scene": "ch31_sc99",
    "due_by_scene": "ch31_sc99",
    "status": "planted",
    "progression_log": [],
    "created_at": "2026-05-18T03:34:16+00:00",
    "updated_at": "2026-05-18T03:34:16+00:00"
  },
  {
    "promise_id": "PP_06",
    "description": "Aelia Vandros will be socially formidable AND publicly diminished — the Foundation's real charity will be the reason Ben cannot morally flatten her, AND the reason her stepping down preserves the harm.",
    "promise_type": "character",
    "setup_scene": "ch17_sc01",
    "payoff_scene": "ch35_sc99",
    "due_by_scene": "ch35_sc99",
    "status": "planted",
    "progression_log": [],
    "created_at": "2026-05-18T03:34:16+00:00",
    "updated_at": "2026-05-18T03:34:16+00:00"
  },
  {
    "promise_id": "PP_07",
    "description": "Sela will save Tavi and the locals through specific Iresh knowledge Ben does not have — the climax rescue will be a shared act of different competencies.",
    "promise_type": "character",
    "setup_scene": "ch24_sc01",
    "payoff_scene": "ch33_sc99",
    "due_by_scene": "ch33_sc99",
    "status": "planted",
    "progression_log": [],
    "created_at": "2026-05-18T03:34:16+00:00",
    "updated_at": "2026-05-18T03:34:16+00:00"
  },
  {
    "promise_id": "PP_08",
    "description": "Talon will name his Glasshook/Tess wound out loud — the prison habits and the comedy valve are the cover for a confession that has to land in Ben's hearing in his own register.",
    "promise_type": "character",
    "setup_scene": "ch06_sc01",
    "payoff_scene": "ch22_sc99",
    "due_by_scene": "ch22_sc99",
    "status": "planted",
    "progression_log": [],
    "created_at": "2026-05-18T03:34:16+00:00",
    "updated_at": "2026-05-18T03:34:16+00:00"
  },
  {
    "promise_id": "PP_09",
    "description": "Ben will preserve the unfinished holocron under a technically-true omission — his most defensible and most dangerous choice will be the same choice.",
    "promise_type": "thematic",
    "setup_scene": "ch34_sc01",
    "payoff_scene": "ch36_sc99",
    "due_by_scene": "ch36_sc99",
    "status": "planted",
    "progression_log": [],
    "created_at": "2026-05-18T03:34:16+00:00",
    "updated_at": "2026-05-18T03:34:16+00:00"
  },
  {
    "promise_id": "PP_10",
    "description": "Aevyn will survive the Glasswell — the precision method that opens the book will outlast the operation that deployed it.",
    "promise_type": "other",
    "setup_scene": "ch01_sc01",
    "payoff_scene": "ch38_sc99",
    "due_by_scene": "ch38_sc99",
    "status": "planted",
    "progression_log": [],
    "created_at": "2026-05-18T03:34:16+00:00",
    "updated_at": "2026-05-18T03:34:16+00:00"
  },
  {
    "promise_id": "PP_11",
    "description": "The One Sith long game will continue — Iresh was one chess move; Dorvan and the broader infiltration program survive Book 1's case being closed.",
    "promise_type": "plot",
    "setup_scene": "ch20_sc01",
    "payoff_scene": null,
    "due_by_scene": null,
    "status": "planted",
    "progression_log": [],
    "created_at": "2026-05-18T03:34:16+00:00",
    "updated_at": "2026-05-18T03:34:16+00:00"
  },
  {
    "promise_id": "PP_12",
    "description": "Luke will sense the omission and not force the answer — the father who knows is the strongest indictment the book can offer.",
    "promise_type": "character",
    "setup_scene": "ch03_sc01",
    "payoff_scene": "ch36_sc99",
    "due_by_scene": "ch36_sc99",
    "status": "planted",
    "progression_log": [],
    "created_at": "2026-05-18T03:34:16+00:00",
    "updated_at": "2026-05-18T03:34:16+00:00"
  }
]
